category,descrip,name,topics,type,views,views_norm
Administration & Finance,"This dataset is a listing of all current City of Chicago employees, complete with full names, departments, positions, employment status (part-time or full-time), frequency of hourly employee ?where applicable?and annual salaries or hourly rate. For hourly employees, the City is providing the hourly rate and frequency of hourly employees (40, 35, 20 and 10) to allow dataset users to estimate annual wages for hourly employees. Please note that annual wages will vary by employee, depending on number of hours worked and seasonal status. For information on the positions and related salaries detailed in the annual budgets, see https://www.cityofchicago.org/city/en/depts/obm.html","Current Employee Names, Salaries, and Position Titles",['personnel'],Dataset,874313.0,1.0
Public Safety,"This dataset reflects reported incidents of crime (with the exception of murders where data exists for each victim) that occurred in the City of Chicago from 2001 to present, minus the most recent seven days. Data is extracted from the Chicago Police Department's CLEAR (Citizen Law Enforcement Analysis and Reporting) system. In order to protect the privacy of crime victims, addresses are shown at the block level only and specific locations are not identified. Should you have questions about this dataset, you may contact the Research & Development Division of the Chicago Police Department at 312.745.6071 or RDAnalysis@chicagopolice.org.  Disclaimer: These crimes may be based upon preliminary information supplied to the Police Department by the reporting parties that have not been verified. The preliminary crime classifications may be changed at a later date based upon additional investigation and there is always the possibility of mechanical or human error. Therefore, the Chicago Police Department does not guarantee (either expressed or implied) the accuracy, completeness, timeliness, or correct sequencing of the information and the information should not be used for comparison purposes over time. The Chicago Police Department will not be responsible for any error or omission, or for the use of, or the results obtained from the use of this information. All data visualizations on maps should be considered approximate and attempts to derive specific addresses are strictly prohibited. The Chicago Police Department is not responsible for the content of any off-site pages that are referenced by or that reference this web page other than an official City of Chicago or Chicago Police Department web page. The user specifically acknowledges that the Chicago Police Department is not responsible for any defamatory, offensive, misleading, or illegal conduct of other users, links, or third parties and that the risk of injury from the foregoing rests entirely with the user.  The unauthorized use of the words ""Chicago Police Department,"" ""Chicago Police,"" or any colorable imitation of these words or the unauthorized use of the Chicago Police Department logo is unlawful. This web page does not, in any way, authorize such use. Data are updated daily. The dataset contains more than 65,000 records/rows of data and cannot be viewed in full in Microsoft Excel. Therefore, when downloading the file, select CSV from the Export menu. Open the file in an ASCII text editor, such as Wordpad, to view and search. To access a list of Chicago Police Department - Illinois Uniform Crime Reporting (IUCR) codes, go to http://data.cityofchicago.org/Public-Safety/Chicago-Police-Department-Illinois-Uniform-Crime-R/c7ck-438e",Crimes - 2001 to present - Dashboard,[],Data Lens,659102.0,0.7538513095424636
Parks & Recreation,"The Chicago Park District maintains weather sensors at beaches along Chicago's Lake Michigan lakefront. These sensors generally capture the indicated measurements hourly while the sensors are in operation during the summer.  During other seasons and at some other times, information from the sensors may not be available.  See https://data.cityofchicago.org/id/qmqz-2xku for a dataset with similar measurements on the lake water, itself.",Beach Weather Stations - Automated Sensors - 2016 - Humidity,"['water', 'recreation', 'parks & recreation', 'open spaces', 'chicago park district']",Chart,516208.0,0.5904155605601198
Buildings,"Permits issued by the Department of Buildings in the City of Chicago from 2006 to the present. The dataset for each year contains more than 65,000 records/rows of data and cannot be viewed in full in Microsoft Excel. Therefore, when downloading the file, select CSV from the Export menu. Open the file in an ASCII text editor, such as Wordpad, to view and search. Data fields requiring description are detailed below. 
PERMIT TYPE: ""New Construction and Renovation"" includes new projects or rehabilitations of existing buildings; ""Other Construction"" includes items that require plans such as cell towers and cranes; ""Easy Permit"" includes minor repairs that require no plans; ""Wrecking/Demolition"" includes private demolition of buildings and other structures; ""Electrical Wiring"" includes major and minor electrical work both permanent and temporary; ""Sign Permit"" includes signs, canopies and awnings both on private property and over the public way; ""Porch Permit"" includes new porch construction and renovation (defunct permit type porches are now issued under ""New Construction and Renovation"" directly); ""Reinstate Permit"" includes original permit reinstatements; ""Extension Permits"" includes extension of original permit when construction has not started within six months of original permit issuance. WORK DESCRIPTION: The description of work being done on the issued permit, which is printed on the permit. PIN1 ? PIN10: A maximum of ten assessor parcel index numbers belonging to the permitted property. PINs are provided by the customer seeking the permit since mid-2008 where required by the Cook County Assessor?s Office. CONTRACTOR INFORMATION: The contractor type, name, and contact information. Data includes up to 15 different contractors per permit if applicable.
Data Owner: Buildings.
Time Period: January 1, 2006 to present.
Frequency: Data is updated daily.
Related Applications: Building Data Warehouse (https://webapps.cityofchicago.org/buildingviolations/violations/searchaddresspage.html).",Building Permits,['permits'],Dataset,405837.0,0.46417816045283555
Ethics,"All lobbyist registration fillings submitted to the Board of Ethics during the 2010 reporting period. / All lobbyists must register with the City of Chicago Board of Ethics by filing a Statement of Registration within five business days of engaging in lobbying activity and annually thereafter by January 20th. 
Lobbyist registration information is submitted to the Board of Ethics in paper form and is available in its entirety in the Board's offices. The Board has, since 2000, compiled and posted static lists of all lobbyists and their clients online. Data for the 2010 reporting period is limited because previous policy did not require the Board of Ethics to prioritize the reporting of all data available from paper filings. 
Moving forward, the Board of Ethics will compile and report more data about lobbyists and their activities, and make that additional information publicly available in machine-readable format. /  
Data Owner:  Board of Ethics 
[http://j.mp/mbH9BN] /
Time Period: January 1, 2010 to December 31, 2010 /
Related Applications:  Registered Lobbyist List [http://j.mp/l8LwAq], 
2011 Lobbyist Registry  [http://j.mp/ifigjs]",Lobbyist Data - Historical - Lobbyist Registry - 2010,"['historical', 'lobbyists']",Dataset,368871.0,0.4218981074283466
Community & Economic Development,"The affordable rental housing developments listed below are supported by the City of Chicago to maintain affordability standards. For information on rents, income requirements and availability, contact each property directly. For information on other affordable rental properties in Chicago and Illinois, call (877) 428-8844, or visit www.ILHousingSearch.org.",Affordable Rental Housing Developments,['housing'],Dataset,324992.0,0.3717112750239331
Public Safety,"This dataset reflects reported incidents of crime (with the exception of murders where data exists for each victim) that occurred in the City of Chicago from 2001 to present, minus the most recent seven days. Data is extracted from the Chicago Police Department's CLEAR (Citizen Law Enforcement Analysis and Reporting) system. In order to protect the privacy of crime victims, addresses are shown at the block level only and specific locations are not identified. Should you have questions about this dataset, you may contact the Research & Development Division of the Chicago Police Department at PSITAdministration@ChicagoPolice.org.  Disclaimer: These crimes may be based upon preliminary information supplied to the Police Department by the reporting parties that have not been verified. The preliminary crime classifications may be changed at a later date based upon additional investigation and there is always the possibility of mechanical or human error. Therefore, the Chicago Police Department does not guarantee (either expressed or implied) the accuracy, completeness, timeliness, or correct sequencing of the information and the information should not be used for comparison purposes over time. The Chicago Police Department will not be responsible for any error or omission, or for the use of, or the results obtained from the use of this information. All data visualizations on maps should be considered approximate and attempts to derive specific addresses are strictly prohibited. The Chicago Police Department is not responsible for the content of any off-site pages that are referenced by or that reference this web page other than an official City of Chicago or Chicago Police Department web page. The user specifically acknowledges that the Chicago Police Department is not responsible for any defamatory, offensive, misleading, or illegal conduct of other users, links, or third parties and that the risk of injury from the foregoing rests entirely with the user.  The unauthorized use of the words ""Chicago Police Department,"" ""Chicago Police,"" or any colorable imitation of these words or the unauthorized use of the Chicago Police Department logo is unlawful. This web page does not, in any way, authorize such use. Data are updated daily. The dataset contains more than 65,000 records/rows of data and cannot be viewed in full in Microsoft Excel. Therefore, when downloading the file, select CSV from the Export menu. Open the file in an ASCII text editor, such as Wordpad, to view and search. To access a list of Chicago Police Department - Illinois Uniform Crime Reporting (IUCR) codes, go to http://data.cityofchicago.org/Public-Safety/Chicago-Police-Department-Illinois-Uniform-Crime-R/c7ck-438e",Crimes - 2001 to present,"['police', 'crime']",Dataset,308074.0,0.35236122532777164
Community & Economic Development,"This dataset contains all current and active business licenses issued by the Department of Business Affairs and Consumer Protection.  This dataset contains a large number of records /rows of data and may not be viewed in full in Microsoft Excel.  Therefore, when downloading the file, select CSV from the Export menu.  Open the file in an ASCII text editor, such as Notepad or Wordpad, to view and search.  

Data fields requiring description are detailed below. 
APPLICATION TYPE:  'ISSUE' is the record associated with the initial license application.  'RENEW' is a subsequent renewal record.  All renewal records are created with a term start date and term expiration date.  'C_LOC' is a change of location record.  It means the business moved.   'C_CAPA' is a change of capacity record.  Only a few license types my file this type of application.  'C_EXPA' only applies to businesses that have liquor licenses.  It means the business location expanded.
LICENSE STATUS: 'AAI' means the license was issued. 
Business license owners may be accessed at:  http://data.cityofchicago.org/Community-Economic-Development/Business-Owners/ezma-pppn
To identify the owner of a business, you will need the account number or legal name.

Data Owner: Business Affairs and Consumer Protection 

Time Period: Current 

Frequency: Data is updated daily",Business Licenses - Current Active,"['current', 'licenses', 'business']",Filtered View,235906.0,0.26981870337053204
Public Safety,"This dataset reflects reported incidents of crime that have occurred in the City of Chicago over the past year, minus the most recent seven days of data. Data is extracted from the Chicago Police Department's CLEAR (Citizen Law Enforcement Analysis and Reporting) system. In order to protect the privacy of crime victims, addresses are shown at the block level only and specific locations are not identified. Should you have questions about this dataset, you may contact the Research & Development Division of the Chicago Police Department at 312.745.6071 or RandD@chicagopolice.org.
Disclaimer: These crimes may be based upon preliminary information supplied to the Police Department by the reporting parties that have not been verified. The preliminary crime classifications may be changed at a later date based upon additional investigation and there is always the possibility of mechanical or human error. Therefore, the Chicago Police Department does not guarantee (either expressed or implied) the accuracy, completeness, timeliness, or correct sequencing of the information and the information should not be used for comparison purposes over time. The Chicago Police Department will not be responsible for any error or omission, or for the use of, or the results obtained from the use of this information. All data visualizations on maps should be considered approximate and attempts to derive specific addresses are strictly prohibited. 
The Chicago Police Department is not responsible for the content of any off-site pages that are referenced by or that reference this web page other than an official City of Chicago or Chicago Police Department web page. The user specifically acknowledges that the Chicago Police Department is not responsible for any defamatory, offensive, misleading, or illegal conduct of other users, links, or third parties and that the risk of injury from the foregoing rests entirely with the user. Any use of the information for commercial purposes is strictly prohibited. The unauthorized use of the words ""Chicago Police Department,"" ""Chicago Police,"" or any colorable imitation of these words or the unauthorized use of the Chicago Police Department logo is unlawful. This web page does not, in any way, authorize such use.
Data is updated daily.",Crimes - Map,"['police', 'crime']",Map,235833.0,0.2697352092442867
Health & Human Services,"This information is derived from inspections of restaurants and other food establishments in Chicago from January 1, 2010 to the present. Inspections are performed by staff from the Chicago Department of Public Health?s Food Protection Program using a standardized procedure. The results of the inspection are inputted into a database, then reviewed and approved by a State of Illinois Licensed Environmental Health Practitioner (LEHP). For descriptions of the data elements included in this set, go to http://bit.ly/tS9IE8
Disclaimer: Attempts have been made to minimize any and all duplicate inspection reports. However, the dataset may still contain such duplicates and the appropriate precautions should be exercised when viewing or analyzing these data. The result of the inspections (pass, pass with conditions or fail) as well as the violations noted are based on the findings identified and reported by the inspector at the time of the inspection, and may not reflect the findings noted at other times. For more information about Food Inspections, go to http://bit.ly/tD91Sb.",Food Inspections,"['inspections', 'food']",Dataset,212867.0,0.243467728376451
Public Safety,Chicago Police district station locations and contact information.,Police Stations,"['gis', 'facilities']",Dataset,209343.0,0.23943713521359056
Administration & Finance,"The Department of Streets & Sanitation's (DSS) Graffiti Blasters crews offer a vandalism removal service to private property owners. This metric tracks the average number of days DSS takes to complete graffiti removal requests per week. Median days to complete requests as well as total number of requests fulfilled per week are available by mousing over columns. Currently the performance target for completing a graffiti removal request is 10 days. For more information on graffiti removal requests, see https://data.cityofchicago.org/d/hec5-y4x5",Performance Metrics - Streets & Sanitation - Graffiti Removal,"['graffiti', 'service delivery', 'performance metrics']",Dataset,206712.0,0.23642791540329378
Community & Economic Development,"Small Business Improvement Fund (SBIF) program grants made since 2001. SBIF uses Tax Increment Financing (TIF) revenues to help owners of commercial and industrial properties within specific TIF districts to repair or remodel their facilities for their own business or on behalf of tenants. For more info, go to http://bit.ly/p91J7T.",Small Business Improvement Fund (SBIF) Grant Agreements,"['sustainability', 'sbif', 'tif']",Dataset,194015.0,0.2219056562123633
Buildings,"This list describes landlords and property owners who are designated  ""problem landlords"". Landlords on this list have had two or more administrative hearing causes brought against them and were found liable or defaulted to one or more serious building violations.",Problem Landlord List - Map,"['violations', 'buildings']",Map,192575.0,0.2202586487905361
Transportation,"Map shows physical locations where CTA fare media, such as Transit Cards, CTA Passes and Chicago Cards were sold through approximately July 2014, prior to the implementation of Ventra cards. The locations for Ventra card sales/reloading are more extensive and not yet available in this format.  Please see http://www.transitchicago.com/ventra for information on the Ventra program and https://www.ventrachicago.com/retailers/locations to find Ventra retail locations.",CTA - Map of Fare Media Sales Outlets (deprecated August 2014),"['deprecated', 'chicago transit authority', 'cta']",Map,188961.0,0.21612511766381148
Transportation,List of all Chicago streets with suffixes and minimum and maximum address numbers.,Chicago Street Names,"['gis', 'streets']",Dataset,154888.0,0.17715394829997952
Community & Economic Development,"Vacant property owned and managed by the City of Chicago Department of Planning and Development. Information provided in the database, or on the City?s website generally, should not be used as a substitute for title research, title evidence, title insurance, real estate tax exemption or payment status, environmental or geotechnical due diligence, or as a substitute for legal, accounting, real estate, business, tax or other professional advice. The City assumes no liability for any damages or loss of any kind that might arise from the reliance upon, use of, misuse of, or the inability to use the LIS database or the City?s web site and the materials contained on the website. The City also assumes no liability for improper or incorrect use of materials or information contained on its website. All materials that appear in the LIS database or on the City?s web site are distributed and transmitted ""as is,"" without warranties of any kind, either express or implied as to the accuracy, reliability or completeness of any information, and subject to the terms and conditions stated in this disclaimer.",City-Owned Land Inventory,['city-owned vacant land'],Dataset,113296.0,0.12958288393287073
Buildings,"The Chicago Building Scofflaw Ordinance (Section 2-92-416 of the Municipal Code of Chicago) is designed to prevent landlords that refuse or refrain from correcting ongoing building code violations from receiving city contracts, including those that subsidize housing. Building owners must have a least three residential buildings with uncorrected violations and have had three or more properties referred to Circuit Court within the applicable 12 month period to be eligible for the list. The building code scofflaw list is updated once a year on the first business day of December, and building owners may appeal being named on the list. Building owners with controlling interest in at least three residential properties that have habitual, extensive or serioues building code violations are now ineligible for any new city contracts in 2015. The following individuals or entities have been placed on the Building Code Scofflaw list for the entire calendar year.",Building Code Scofflaw List - Map,"['violations', 'buildings', 'scofflaw']",Map,101614.0,0.1162215362232976
Service Requests,"This map shows potholes patched in the last seven days, based on the corresponding 311 service requests at https://data.cityofchicago.org/id/7as2-ds3y.",Potholes Patched - Last Seven Days,"['pot holes', 'streets']",Map,86803.0,0.09928137863671248
Education,"Chicago Public Library locations, contact information, and hours of operation.","Libraries - Locations, Hours and Contact Information","['gis', 'facilities', 'libraries']",Dataset,82302.0,0.09413333668834845
Buildings,"Violations issued by the Department of Buildings from 2006 to the present.  Lenders and title companies, please note: These data are historical in nature and should not be relied upon for real estate transactions. For transactional purposes such as closings, please consult the title commitment for outstanding enforcement actions in the Circuit Court of Cook County or the Chicago Department of Administrative Hearings. Violations are always associated to an inspection and there can be multiple violation records to one inspection record. Related Applications: Building Data Warehouse http://www.cityofchicago.org/city/en/depts/bldgs/provdrs/inspect/svcs/building_violationsonline.html. The information presented on this website is informational only and does not necessarily reflect the current condition of the building or property. The dataset contains cases where a respondent has been found to be liable as well as cases where the respondent has been found to be not liable.",Building Violations,"['inspections', 'violations']",Dataset,77471.0,0.08860785553914902
Service Requests,"All 311 calls for open and vacant buildings reported to the City of Chicago since January 1, 2010. The information is updated daily with the previous day's calls added to the records. The data set provides the date of the 311 service request and the unique Service Request # attached to each request. For each request, the following information (as reported by the 311 caller) is available: address location of building; whether building is vacant or occupied; whether the building is open or boarded; entry point if building is open; whether non-residents are occupying or using the building, if the building appears dangerous or hazardous and if the building is vacant due to a fire.",311 Service Requests - Vacant and Abandoned Buildings Reported,['buildings'],Dataset,74284.0,0.08496270786320231
Facilities & Geographic Boundaries,"Current community area boundaries in Chicago. The data can be viewed on the Chicago Data Portal with a web browser. However, to view or use the files outside of a web browser, you will need to use compression software and special GIS software, such as ESRI ArcGIS (shapefile) or Google Earth (KML or KMZ), is required.",Boundaries - Community Areas (current),"['gis', 'boundaries', 'shapefiles', 'kml', 'kmz']",Map,70568.0,0.0807125137107649
Community & Economic Development,"List of City of Chicago licensed Public Chauffeurs, who may operate a licensed Taxicab, Livery, or Horse-Drawn Carriage. For questions or issues regarding this dataset, please e-mail BACPPV@cityofchicago.org with chauffeur name, number, and question or issue. For more information on the Public Chauffeur program, please see http://www.cityofchicago.org/city/en/depts/bacp/supp_info/public_chauffeurinformation.html.",Public Chauffeurs,"['transportation', 'licenses']",Dataset,69413.0,0.07939147650784101
Transportation,"This dataset displays location for vehicles that have been towed and impounded by the City of Chicago within the last 90 days. Illegally parked vehicles, abandoned vehicles and vehicles used for illegal activities may be towed by the Chicago Police Department, the Department of Streets and Sanitation, the Department of Revenue, Aviation and the office of the City Clerk. After a tow request is issued, an inventory number is assigned by the Department of Streets and Sanitation and a truck is dispatched to tow the requested vehicle to a City auto pound. Disclaimer: This dataset includes vehicles towed or relocated by the City of Chicago; it does not include vehicles towed by a private towing company. 
Background Info: 
Auto Pound Locations (http://j.mp/kG5sgF).
Tow Process Overview (http://j.mp/lfBOEP).
Common Towing Questions (http://j.mp/imFYlp).
Parking and Standing Violations (http://j.mp/ifW8Uj).
Data Owner: Chicago Police Department.
Time Period: Last 90 days.
Frequency: Data is updated daily.
Related Applications: Find Your Vehicle (http://j.mp/lWn0S7).",Towed Vehicles,"['streets', 'vehicles']",Dataset,63732.0,0.07289380347770193
Public Safety,Police station locations in Chicago,Police Stations - Map,"['gis', 'facilities']",Map,58451.0,0.0668536325091815
