category,descrip,name,topics,type,views,views_norm
Environment & Sustainable Development,"The full list of buildings required to comply with the Chicago Energy Benchmarking Ordinance. As of 2016, this list includes all commercial, institutional, and residential buildings larger than 50,000 square feet. The information in this dataset should be used by building owners / managers or other building representatives to determine if your property needs to comply by the annual deadline of June 1st. This data can also be used to look up your property's unique 6-digit Chicago Energy Benchmarking ID, which is required for compliance. (The ID is also included the notification letters sent by the City.)The Energy Benchmarking Ordinance calls on existing municipal, commercial, and residential buildings larger than 50,000 square feet to track whole-building energy use, report to the City annually, and verify data accuracy every three years. The law, which phases in from 2014-2017, covers less than 1% of Chicago?s buildings, which account for approximately 20% of total energy used by all buildings. For more details, including ordinance text, rules and regulations, and timing, please visit www.CityofChicago.org/EnergyBenchmarking.Note that the ordinance authorizes the City to make individual building data readily-available to the public, beginning with the second year in which a building is covered. The Covered Buildings List is distinct from the publicly-shared energy use data, and does not include energy use or any other information reported in the benchmarking process. For the building-specific energy use dataset, see https://data.cityofchicago.org/d/xq83-jr8c.If your property is on this list, and you do not believe you are covered by the ordinance, please submit the appropriate online exemption form at: www.CityofChicago.org/EnergyBenchmarking. If your property is not on the list, and it meets the compliance criteria, please check for any alternative building addresses. If the building is still not found, please submit the Building ID Request Form. The Chicago Energy Benchmarking Help Center can assist with any other questions, and can be reached at (855)858-6878, or by email: Info@ChicagoEnergyBenchmarking.org.This dataset will be refreshed periodically as additional information becomes available. It is advisable to use the then-current version of any dataset, if possible.",Chicago Energy Benchmarking - Covered Buildings,[],Data Lens,478.0,0.0005467149636343048
,"This dataset shows bus runs held unfulfilled as a result of absenteeism. Absent, in this context, indicates unscheduled days off work. Note: Total does not include bus hold-ins caused by absenteeism related to the blizzard of February, 2011.","CTA - Performance - Chart of Bus Runs Held Due to Absenteeism (2011, Jan-Aug)","['chicago transit authority', 'cta']",Chart,477.0,0.0005455712084802582
Administration & Finance,"A Bed and Breakfast License is required to rent out rooms in a home to overnight guests, and to provide a breakfast meal.  Currently the performance target for processing Bed and Breakfast Licenses is 15 days.",Performance Metrics - Business Affairs & Consumer Protection - Bed and Breakfast Establishment Licenses (1374),"['licenses', 'business', 'service delivery', 'performance metrics']",Filtered View,476.0,0.0005444274533262115
Education,"Preference boundaries for selected charter schools in the Chicago Public Schools district for school year 2014-15. As opposed to elementary or high school attendance boundaries wherein each residing student is entitled to attend, charter boundaries simply serve as a guide for charter school administrators to use during the application/lottery process. Applicants residing within a specific boundary are generally given preference over applicants residing outside of the boundary. To view or use these shapefiles, compression software, such as 7-Zip, and special GIS software, such as Google Earth or ArcGIS, are required.",Chicago Public Schools - Charter School Preference Boundaries SY1415,"['shapefiles', 'kmz', 'kml', '2015', '2014']",Map,471.0,0.0005387086775559783
Administration & Finance,"The dataset details 2014 Budget Recommendations, which is the line-item budget document proposed by the Mayor to the City Council for approval. Budgeted expenditures are identified by department, appropriation account, and funding type: Local, Community Development Block Grant Program (CDBG), and other Grants. ?Local? funds refer to those line items that are balanced with locally-generated revenue sources, including but not limited to the Corporate Fund, Water Fund, Midway and O?Hare Airport funds, Vehicle Tax Fund, Library Fund and General Obligation Bond funds. Owner: Budget and Management. Frequency: Data is updated annually. For more information about the budget process, visit the Budget Documents page: http://j.mp/lPotWf.",2014 Budget Recommendations - Appropriations - Tree Map,"['2014', 'budget']",Chart,467.0,0.0005341336569397916
Education,"Summer Reads for Adults is offered in June and July. The program provides participants with the opportunity to explore a central theme through a wide variety of suggested readings and to participate in related and inventive programming such as lectures, discussions, tours and performances.",Libraries - Summer Reads for Adults,"['summer reading', 'programs', 'libraries']",Dataset,466.0,0.0005329899017857449
Community & Economic Development,"The City of Chicago launched the Micro-Market Recovery Program (MMRP), a coordinated effort among the City, not-for-profit intermediaries, and non-profit and for-profit capital sources to improve conditions, strengthen property values, and create environments supportive of private investment in targeted markets throughout the city. The goal of MMRP is to improve conditions, strengthen property values, and create environments supportive of private investment in targeted areas by strategically deploying public and private capital and other tools and resources in well-defined micro-markets. This dataset shows the areas covered by the MMRP program. The data can be viewed on the Chicago Data Portal with a web browser. However, to view or use the files outside of a web browser, you will need to use compression software and special GIS software, such as ESRI ArcGIS (shapefile) or Google Earth (KML or KMZ).  For more information on the MMRP program, please see http://www.regionalhopi.org/content/city-chicago-micro-market-recovery-program-overview.",Boundaries - Micro-Market Recovery Program - Zones,"['buildings', 'inspections', 'boundaries', 'gis', 'kml']",Map,464.0,0.0005307023914776516
Administration & Finance,"As discussed in http://bit.ly/wardpost, the City of Chicago changed to a new ward map on 5/18/2015, affecting some datasets.  This ZIP file contains a CSV export from 5/15/2015 of the ""Crimes - 2001 to present"" dataset.  Due to size limitations, this file had to be separated from the CSV exports of the other datasets, which are at https://data.cityofchicago.org/d/q6z8-94kn.  This CSV file contains a close-to-final version of the crimes dataset with the previous (""2003"") ward values.",2003 Ward Dataset CSVs - Crimes - 2001 to present,"['crime', 'ward', 'historical']",File or Document,462.0,0.0005284148811695583
Environment & Sustainable Development,"Locations provided by the city to recycle Christmas trees from January 4 through January 18, 2014. For more information, see http://www.cityofchicago.org/city/en/depts/streets/provdrs/streets_san/news/2013/dec/city-of-chicago-to-offer-christmas-tree-recycling-at-23-citywide.html",Christmas Tree Recycling Locations 2014 - Map,"['recycling', 'sustainability']",Map,461.0,0.0005272711260155116
Facilities & Geographic Boundaries,"KML file of cemeteries located in Cook County. To view or use these files, special GIS software such as Google Earth is required.",Cook County - Cemeteries - KML,"['kml', 'gis', 'county']",File or Document,458.0,0.0005238398605533716
Health & Human Services,"The annual number of newly reported, laboratory-confirmed cases of chlamydia (Chlamydia trachomatis) among males aged 15-44 years and annual chlamydia incidence rate (cases per 100,000 males aged 15-44 years) with corresponding 95% confidence intervals by Chicago community area, for years 2000 ? 2014. See the full description by clicking on the maroon ""About"" button on the right-hand side of the screen, and click on the PDF under ""Attachments"".","Public Health Statistics - Chlamydia cases among males aged 15-44 in Chicago, by year, 2000-2014","['sexually transmitted', 'std', 'sti']",Dataset,458.0,0.0005238398605533716
Sanitation,"Blue Cart Residential Recycling zones and schedule. Each recycling zone is divided into two sections ? A (Orange) and B (Yellow). Collection is done on an alternating-week basis. For 2012, B/Yellow sections were collected the week of 1/2/2012 and A/Orange sections were collected the week of 1/9/2012, continuing to alternate from there. See http://bit.ly/wssHIB or https://data.cityofchicago.org/d/eb3b-ehmq for the full schedule. For more about Recycling in Chicago, visit http://bit.ly/IcfLHr. To view or use these files, compression software and special GIS software, such as ESRI ArcGIS, is required.",Boundaries - Recycling Service Areas - Shapefile (Deprecated March 2013),"['sustainability', 'shapefiles', 'recycling', 'deprecated', 'boundaries']",File or Document,457.0,0.0005226961053993249
Health & Human Services,"City of Chicago Mental Health, Sexually Transmitted Infection (STI) Specialty, and Women Infant Children (WIC) clinic locations, hours of operation and contact information. Note that some locations have multiple clinic types but will show as a single dot on this map.",Chicago Department of Public Health Clinic Locations - Map - All Clinic Types,"['healthy families', 'healthy start', 'case management', 'mental health', 'wic']",Map,456.0,0.0005215523502452783
Environment & Sustainable Development,"Locations provided by the city to recycle Christmas trees from January 3 through January 21, 2017. For more information, see http://chicagorecycles.org",Christmas Tree Recycling Locations 2017 - Map,"['sustainability', 'recycling']",Map,456.0,0.0005215523502452783
Administration & Finance,"This metric tracks workforce employment services including basic services, skills training and job placement per month. DFSS provides workforce development services to low income adults, dislocated workers and ex-offenders. These services include job readiness training, vocational training, job placement, supportive services and post-placement retention services.
The Chicago-Cook Workforce Partnership, a newly created agency designed to reform and revitalize workforce development in the greater Chicagoland area, took over operation of DFSS?s Workforce Investment Act funding and delegate agency contracts on July 1, 2012.  http://www.workforceboard.org",Performance Metrics - Family & Support Services - Workforce Services Monthly Utilization,"['human services', 'service delivery', 'performance metrics']",Dataset,453.0,0.0005181210847831383
Education,2015 school progress report ratings for all Chicago Public Schools.,Chicago Public Schools - School Progress Reports SY1516,"['2016', '2015', 'report cards', 'metrics', 'schools']",Dataset,452.0,0.0005169773296290917
Community & Economic Development,"Combined statements of revenues, expenditures, and changes in fund balances for the year ending December 31, 2009.",TIF Balance Sheets - Englewood Neighborhood,['tif'],Filtered View,451.0,0.000515833574475045
Health & Human Services,"City of Chicago Mental Health, Sexually Transmitted Infection (STI) Specialty, and Women Infant Children (WIC) clinic locations, hours of operation and contact information.",Chicago Department of Public Health Mental Health Clinic Locations,"['healthy families', 'healthy start', 'case management', 'mental health', 'wic']",Filtered View,449.0,0.0005135460641669516
Transportation,"This dataset shows bus runs held unfulfilled as a result of absenteeism. Absent, in this context, indicates unscheduled days off work. Note: Total does not include bus hold-ins caused by absenteeism related to the blizzard of February, 2011.","CTA - Performance - Bus Runs Held Due to Absenteeism (2011, Jan-Aug)","['chicago transit authority', 'cta']",Dataset,449.0,0.0005135460641669516
Sanitation,"Street sweeping zones by Ward and Ward Section Number. The zones are the same as those used in 2014. For the corresponding schedule, see https://data.cityofchicago.org/d/waad-z968. Because the City of Chicago ward map will change on May 18, 2015, this dataset will be supplemented with an additional dataset to cover the remainder of 2015 (through November).
For more information about the City's Street Sweeping program, go to http://bit.ly/H2PHUP. The data can be viewed on the Chicago Data Portal with a web browser. However, to view or use the files outside of a web browser, you will need to use compression software and special GIS software, such as ESRI ArcGIS (shapefile) or Google Earth (KML or KMZ).",Street Sweeping - 2015 - April-May - Map,"['2015', 'boundaries', 'gis', 'kml', 'kmz']",Map,448.0,0.000512402309012905
Facilities & Geographic Boundaries,"KML file of Cook County facilities. To view or use these files, special GIS software such as Google Earth is required.",Cook County - Facilities - KML,"['kml', 'gis', 'county']",File or Document,441.0,0.0005043960229345783
Community & Economic Development,"Combined statements of revenues, expenditures, and changes in fund balances for the year ending December 31, 2009.",TIF Balance Sheets - Elston/Armstrong Industrial Corridor,['tif'],Filtered View,439.0,0.000502108512626485
Administration & Finance,"The dataset details 2017 Budget Recommendations, which is the line-item budget document proposed by the Mayor to the City Council for approval. Budgeted expenditures are identified by department, appropriation account, and funding type: Local, Community Development Block Grant Program (CDBG), and other Grants. ?Local? funds refer to those line items that are balanced with locally-generated revenue sources, including but not limited to the Corporate Fund, Water Fund, Midway and O?Hare Airport funds, Vehicle Tax Fund, Library Fund and General Obligation Bond funds. Owner: Budget and Management. Frequency: Data are updated annually. For more information about the budget process, visit the Budget Documents page: http://j.mp/lPotWf.",Budget - 2017 Budget Recommendations - Appropriations,"['2017', 'budget']",Dataset,438.0,0.0005009647574724384
Administration & Finance,"The Department of Natural Resources (CDNR) was created in 2001 and is responsible for ensuring the quality of the district's 7,300 acres of land. Through enhanced landscape management, staff training and constant high quality maintenance, the department is quickly becoming the benchmark by which many municipal organizations measure the quality of their landscape and gardening. The Department also manages the contract that the Park District uses for garbage and recycling pick-ups. The data displayed below represents the monthly gross recycling  tonnage that is collected compared to 2010.",Performance Metrics - Chicago Park District - Natural Resources Recycling,"['sustainability', 'parks', 'performance metrics']",Dataset,437.0,0.0004998210023183917
Transportation,"KML file of routes located in Cook County. To view or use these files, special GIS software such as Google Earth is required.",Cook County - Highway Department - Jursidictions - KML,"['kml', 'gis', 'streets', 'highways', 'county']",File or Document,436.0,0.0004986772471643451
Community & Economic Development,"No new tavern licenses can be issued to any location that is within 400 feet of existing businesses already licensed for the sale of alcoholic liquor in certain zoning districts. Measurements are made from the property line and exclude streets, alleys, and public ways. This prohibition does not apply to restaurants, hotels offering restaurant services, or not-for-profit clubs. There are nine major classes of liquor licenses in the City of Chicago, the most common being Tavern, Package Goods and Incidental - Consumption on Premises. These categories were established to help the City identify and regulate the various types of establishments serving alcoholic beverages. They are described at the following link: http://bit.ly/P0Gn4c. The Chicago City Council has passed a series of ordinances restricting the issuance of liquor licenses in various locations throughout the City in sections 4-60-022 and 4-60-023 of the Municipal Code. In general, consumption on premises liquor licenses are affected by the 022 moratorium and Package Goods are affected by the 023 moratorium. However, moratoriums can be complicated, so determining whether or not a moratorium applies to a specific license application is not always straightforward. Users of the data should contact the Department of Business Affairs and Consumer Protection if they have any questions. These GIS layers show the locations of moratoriums passed by the City Council. It is updated monthly if any restrictions have been added or deleted. Columns are as follows: ?	CODE refers to the specific ordinance passed by City County. If there are more than one, they are connected by an underscore. They are in the format ww.nnn where ww is the ward number and nnn is a sequential number. ?	ST_SDE refers to which side of the street the ordinance refers to. ?	CREADATE is the date that the ordinance was input into the digital system, usually within a week after passed by City Council. Dates before 2003 do not relect the actual date passed. 
To view or use this KML file, special GIS software such as Google Earth is required. To download, right-click the ""Download"" link above and choose ""Save link as.""",Liquor Moratorium Districts - Taverns - KML,"['kml', 'gis', 'liquor']",File or Document,436.0,0.0004986772471643451
Parks & Recreation,"Facilities managed & maintained by the Chicago Park District as of November 4, 2016.",Parks - Chicago Park District Facilities (current),"['2016', 'chicago parks', 'chicago park district', 'chicago', 'recreation']",Map,432.0,0.0004941022265481583
Public Safety,"Police district boundaries in Chicago that are effective as of December 19, 2012. The data can be viewed on the Chicago Data Portal with a web browser. However, to view or use the files outside of a web browser, you will need to use compression software and special GIS software, such as ESRI ArcGIS (shapefile) or Google Earth (KML or KMZ), is required.",Boundaries - Police Districts (effective 12/19/2012),"['boundaries', 'gis', 'shapefiles', 'kml']",Map,431.0,0.0004929584713941117
,"Circulation figures include new checkouts as well as renewals. The Chicago Public Library consists of the Harold Washington Library Center, Sulzer and Woodson regional libraries and over 70 neighborhood branches. Many locations experience sporadic emergency closures due to heating or air conditioning issues, or area power outages. Independence Branch closed due to a fire on 10/30/15.",Libraries -  2016 Circulation by Location,"['performance metrics', 'circulation', 'libraries']",Dataset,430.0,0.000491814716240065
Education,"Materials pulled to fulfill patron holds. The Chicago Public Library opened four new locations in 2011: Greater Grand Crossing (4/23/11); Dunning (5/6/11); Daley, Richard M.-W Humboldt (7/8/11) and Little Village (10/3/11). Edgewater closed 6/16/11 for construction of a new branch; a bookmobile for holds pickup and returns opened 6/24/11. Altgeld closed for extended periods in July and August for air conditioning installation. Back of the Yards closed permanently 8/22/11 due to repeated flooding. All locations were closed February 2-February 3 due to weather. In addition, many locations experienced sporadic closures in summer 2011 due to weather-related issues.",Libraries - 2011 Holds Filled by Location,"['holds', 'libraries']",Dataset,430.0,0.000491814716240065
Education,"Locations of educational units in the Chicago Public School District for school year 2016-2017. To view or use these shapefiles, compression software, such as 7-Zip, and special GIS software, such as Google Earth or ArcGIS, are required.",Chicago Public Schools - School Locations SY1617,"['shapefiles', 'kmz', 'kml', '2017', '2016']",Map,430.0,0.000491814716240065
Education,"Patrons may place holds on desired materials either online or by contacting any CPL location. The Chicago Public Library consists of the Harold Washington Library Center, Sulzer and Woodson regional libraries and over 70 neighborhood branches. Edgewater Branch reopened in a new, 2-story facility on 6/22/2013. Humboldt Park Branch closed 3/26/2012 for construction of a 5,000-square-foot addition; it reopened 2/9/2013. Albany Park Branch closed 9/22/2012 for construction of a new branch expected to open in 2014. Interim services are being provided in the Albany Park community. Gage Park Branch closed 2/22/2013-3/1/2013 for full carpet replacement and South Shore Branch was closed from 5/13/2013-6/29/2013 for repairs and renovation. Many locations experience sporadic emergency closures due to heating or air conditioning issues, or area power outages.",Libraries - 2013 Holds Placed by Location,"['holds', 'libraries']",Dataset,425.0,0.00048609594046983176
Parks & Recreation,"Groves within the Forest Preserve District of Cook County. To view or use these shapefiles, compression software and special GIS software, such as ESRI ArcGIS, is required.",Cook County - Forest Preserve Groves,"['county', 'forest preserves', 'gis', 'shapefiles', 'sustainability']",File or Document,424.0,0.0004849521853157851
Administration & Finance,Number Of City Employees And Officials Completing Mandatory Annual Ethics Training,Performance Metrics - Ethics - Mandatory Annual Ethics Training,"['personnel', 'ethics', 'performance metrics']",Dataset,422.0,0.0004826646750076918
Facilities & Geographic Boundaries,"Boundaries of Chicago's surrounding municipalities. To view or use these files, special GIS software such as Google Earth is required. To download, right-click the ""Download"" link above and choose ""Save link as.""",Boundaries - Surrounding Municipalities - KML,"['kml', 'gis', 'boundaries']",File or Document,419.0,0.00047923340954555174
Administration & Finance,"Limited Business Licenses (LBLs) are required for all Chicago businesses not specifically exempt from licensing requirements. This includes all business that provide services, or engage in office operations or general sales. Currently the performance target for processing Limited Business Licenses is 3 days.",Performance Metrics - Business Affairs & Consumer Protection - Limited Business Licenses,"['licenses', 'business', 'service delivery', 'performance metrics']",Dataset,419.0,0.00047923340954555174
Buildings,A list of buildings excluded from short-term rental activity under the Shared Housing Ordinance.  See https://www.cityofchicago.org/city/en/depts/bacp/provdrs/bus/alerts/2016/july/Prohibited_Buildings_List_Affidavit.html for more information on the exclusion process.,House Share Prohibited Buildings List - Map,"['restrictions', 'regulation', 'house share']",Map,419.0,0.00047923340954555174
Administration & Finance,"Number Of Annual Statements Of Financial Interests Filed, Reviewed And Posted Online",Performance Metrics - Ethics - Statements Of Financial Interests Filed,"['personnel', 'ethics', 'performance metrics']",Dataset,415.0,0.0004746583889293651
Parks & Recreation,"The Chicago Park District maintains weather sensors at beaches along Chicago's Lake Michigan lakefront. These sensors generally capture the indicated measurements hourly while the sensors are in operation during the summer.  During other seasons and at some other times, information from the sensors may not be available.  See https://data.cityofchicago.org/id/qmqz-2xku for a dataset with similar measurements on the lake water, itself.",Beach Weather Stations - Automated Sensors - 2016 - Wind Speed,"['water', 'recreation', 'parks & recreation', 'open spaces', 'chicago park district']",Chart,414.0,0.00047351463377531843
Transportation,"CTA Bus Garages ? Point data representing bus garage and facilities maintenance locations.
Projected Coordinate System:	NAD_1983_StatePlane_Illinois_East_FIPS_1201_Feet",CTA - Bus Garages - kml,"['garage', 'bus', 'kml', 'cta']",File or Document,413.0,0.00047237087862127177
Facilities & Geographic Boundaries,"OUTDATED. See the current data at https://data.cityofchicago.org/d/fwns-qqic -- To view or use these files, compression software and special GIS software, such as ESRI ArcGIS, is required. To download, right-click the ""Download"" link above and choose ""Save link as."" This version of the data was posted 8/8/2012 and stayed live until 7/16/2015, when it was replaced with the list of aldermen inaugurated 5/18/2015, after allowing time for most office space arrangements to be finalized.",Ward Offices - Shapefiles (Deprecated May 2015),"['deprecated', 'facilities', 'shapefiles', 'gis']",File or Document,412.0,0.0004712271234672251
Community & Economic Development,"Combined statements of revenues, expenditures, and changes in fund balances for the year ending December 31, 2009.",TIF Balance Sheets - Central Loop,['tif'],Filtered View,411.0,0.00047008336831317845
