category,descrip,name,topics,type,views,views_norm
Property & Taxation,"Mortgages recorded between January 1, 2011 and December 31, 2011",Cook County Recorder of Deeds - Mortgages - 2011 Complete!,[],Dataset,591.0,0.010732965276768851
Finance & Administration,"This dataset is no longer updated. For updated datasets please search for ""Registered with the Cook County Department of Revenue."" This dataset may be removed in the future. A listing of the businesses in unincorporated Cook County subject to Liquor, Gasoline, New Motor Vehicle, Dealer Use, Diesel, Amusement, and Parking Home Rule Taxes. Data last updated September 08, 2011",Historical - Department of Revenue - Businesses Subject to Home Rule Taxes - 2011 through September 8th,[],Dataset,583.0,0.0105876797907889
Property & Taxation,2011 Scavenger Sale Rules and Regulations,Treasurer 2011 Scavenger Sale Rules And Regulations,"[u'cook county treasurer', u'2011 scavenger sale', u'tax sale', u'sold pin', u'rules']",File or Document,577.0,0.010478715676303938
GIS/Maps,"The PLSS data is modeled as a single composite network coverage that encompasses townships (area), sections (subarea), quarter sections, and half quarter section. If an indigenous people's reserve was present on the tax map, it was digitized to create subpolygons of the half-quarter section, and those polygons were attributed with the name of the reserve. Within this PLSS data set, a half-quarter section is the smallest polygon unit, except in cases where an Indigenous People's Reserve line is present.",ccgisdata - Section 2014,"[u'plss', u'section', u'township', u""indigenous people's reserve""]",Map,568.0,0.010315269504576494
GIS/Maps,"The County's system of tax maps is based on the Illinois Public Land Survey System (PLSS). In the PLSS, each township is divided into 36 sections, and each section into four quarter-sections. A quarter-section is further divided into two tax map sheets, often called ""pages"". Each tax map (1/4 mile by 1/2 mile) represents the east or west half of one quarter-section, and typically there are eight tax maps per section.",ccgisdata - PLSS Line 2014,"[u'gis', u'plss', u'survey', u'township', u'section']",Map,565.0,0.01026078744733401
GIS/Maps,"Groves within the Forest Preserve District of Cook County. To view or use these shapefiles, compression software and special GIS software, such as ESRI ArcGIS, is required.",Forest Preserve/GIS--Shapefile of groves in Cook County Forest Preserves,"[u'forest preserve', u'gis', u'maps', u'groves']",File or Document,563.0,0.010224466075839024
Finance & Administration,"This dataset is for historical reference only. For current information see https://datacatalog.cookcountyil.gov/d/6ybd-qcyy. Data last updated March 26, 2012. Exhibit B of the Cook County Employment Plan, shows all Shakman Exempt positions for each department in the Offices Under the President. Department, Job Title, Job Code, Position ID and link to Job Description are included.",Human Resources - Employment Plan Exempt List - Departments Under the President - Historical,[],Dataset,549.0,0.00997021647537411
Finance & Administration,"From the Department of Environmental Control, a dataset of asbestos demolition permits for 3Q 2012.",Environmental Control - Asbestos Demolition Permits - 2012 Q3,[],Dataset,532.0,0.009661484817666715
Property & Taxation,This dataset shows what agencies are in a tax code for each tax year along with the agency and tax code rates. Data is updated yearly. For more information on Tax codes and Tax agencies visit the Cook County Clerk's website at: http://www.cookcountyclerk.com/tsd/Pages/default.aspx,"Cook County Clerk - Tax codes, agencies, and rates",[],Dataset,532.0,0.009661484817666715
Finance & Administration,"This dataset provides the list of vendors to be recommended for award at the Cook County Board Meetings and are posted below for public viewing.
M/W/DBE Participation Types
MBE = Minority Business Enterprise
WBE = Women Business Enterprise
DBE = Disadvantaged Business Enterprise
Native American (4)
African American (5)
Female (7)
Asian (8)
Hispanic (9)",Procurement - Intent to Award,"[u'procurement', u'purchase', u'contract', u'bid', u'rfp']",Dataset,530.0,0.009625163446171727
GIS/Maps,Cook County GIS Dept map of Commissioner District 1.,ccgismap - Cook County Commissioner District 01,"[u'commissioner district', u'cook county', u'map', u'gis']",File or Document,514.0,0.009334592474211827
