category,descrip,name,topics,type,views,views_norm
Finance & Administration,"Click on the link to see or download a PDF of the contract. This dataset contains new contracts and amendments. Amendments may be contract extensions, renewals, increases, decreases, scope changes, or any combination of these. Amendment data is included starting with Fiscal Year 2015 (December 2014).",Procurement - Awarded Contracts & Amendments,"[u'procurement', u'purchase', u'contract', u'bid', u'rfp']",Dataset,55064.0,1.0
Finance & Administration,"Annual salaries paid to employees by the Cook County Comptroller as of August 28, 2014. For 2015 data see https://datacatalog.cookcountyil.gov/d/9tzu-m4zi.",Comptroller - Annual Salaries - 2014 - August 28,[u'salary'],Dataset,46109.0,0.8373710591311928
Finance & Administration,"Annual salaries paid to employees by the Cook County Comptroller as of September 22, 2011. Does not include deduction for furlough or closure days for employees subject to furloughs and closures. Does not include amounts paid by other governmental entities. For 2014 salaries see https://datacatalog.cookcountyil.gov/resource/hdna-35se",Comptroller - Annual Salaries - 2011 - September 22,[],Dataset,27719.0,0.5033960482347813
Economic Development,"Use the tools at right to find the Cook County Government location or service you need.  Click on the icon to see the location name, type, type of service offered, and contact information.",Facilities Management -- Find it Fast - Cook County Public Facilities and Services Map,"[u'cook county facilities and services locator', u'capital planning and policy']",Map,18148.0,0.3295801249455179
Finance & Administration,"Annual salaries paid to employees by the Cook County Comptroller as of March 5, 2013. Does not include deduction for furlough or closure days for employees subject to furloughs and closures. Does not include amounts paid by other governmental entities. For 2014 salaries see https://datacatalog.cookcountyil.gov/resource/hdna-35se",Comptroller - Annual Salaries - 2013,[],Dataset,14942.0,0.2713569664390527
Property & Taxation,"Foreclosures recorded from January 1, 2012 through November 29, 2012",Cook County Recorder of Deeds - Foreclosures - 2012 January 1 to November 29,[u'foreclosures'],Dataset,10913.0,0.1981875635624001
Finance & Administration,,Cook County Commissioner District Map,[],Map,6447.0,0.1170819410140927
Finance & Administration,"Annual salaries paid to employees by the Cook County Comptroller as of September 16, 2011. Does not include deduction for furlough or closure days for employees subject to furloughs and closures. Does not include amounts paid by other governmental entities. For 2014 salaries see https://datacatalog.cookcountyil.gov/resource/hdna-35se",Comptroller - Annual Salaries - 2011 - September 16,[],Dataset,5995.0,0.10887331105622548
Finance & Administration,"2012 budget requests by line-item, by bureau, and elected official.",Budget Management - 2012 Budget Request - Summary of Appropriations by Object Classification,[u'2012 budget'],Dataset,4689.0,0.08515545546999854
Healthcare,"The following page lists the final disposition sites of the indigents buried by the Cook County Medical Examiner’s Office. Homewood Memorial Gardens Cemetery provides Latitude and Longitude coordinates. Mount Olivet provides Grave, Lot, and Block locations.",Medical Examiner - Burial Locations,[],Dataset,3855.0,0.0700094435565887
Property & Taxation,,Cook County Recorder of Deeds - Quit Claim Deeds - 2012 January 1 to November 29,[u'quit claim deeds'],Dataset,3257.0,0.05914935347958739
Finance & Administration,"¹ Includes Sales Tax previously allocated to JTDC for FY08--9.  Reflects rate reduction for last 2 months of FY10, last 8 months of FY12 and FY13
 ² Provided for comparison purposes to revenues as shown in Revenue Estimate
 ³ Sources: FY07-FY11 from Budget Citizen's Summary, Q-1 Total General Fund Expenditures.   FY13-16 based on FY12 with 3.2% annual growth (10 year CPI-U-2.44%/Health-8%).",Cook County Budget - 2012 - Budget Long-term Forecast,[],Dataset,3136.0,0.05695191050414063
GIS/Maps,The Parcel 2012 feature contains tax parcel polygons for the 2012 property tax assessment at the County. This feature reflects tax parcel polygons as they existed from 1/1/2012 through 12/31/2012. Each parcel is uniquely identified with a Property Index Number (PIN).,ccgisdata - Parcel 2012,"[u'cook', u'parcel', u'gis', u'clerk', u'map']",Map,3080.0,0.055934912102280986
Finance & Administration,"This check register provides a cumulative record of payments to County suppliers, vendors and other payees as approved by the Cook County Board of Commissioners. Data covers December 2009 through June 2016.",Cook County Check Register,"[u'check register', u'check registry', u'payments']",Dataset,2991.0,0.05431861107075403
Finance & Administration,"Annual salaries paid to employees by the Cook County Comptroller as of November 24, 2015. This dataset does not include salaries for Cook County Forest Preserves. This is the newest salaries dataset. 
For 2014, see https://datacatalog.cookcountyil.gov/d/hdna-35se.",Comptroller - Annual Salaries - 2015 - November 24,[u'salary'],Dataset,2819.0,0.05119497312218509
Property & Taxation,,Cook County Recorder of Deeds - Mortgages - 2012 January 1 to November 29,[u'mortgages'],Dataset,2769.0,0.050286938834810405
Property & Taxation,Scavenger Tax Sale: A sale held every two years by the Treasurer selling taxes on property with 2 or more years of delinquent taxes.,Treasurer - 2011 Scavenger Sale No-bid PINs,[],Dataset,2710.0,0.04921545837570827
Courts,,Chief Judge--Directory Of Judges,[],Dataset,2623.0,0.047635478715676305
Property & Taxation,"Foreclosures recorded with the Cook County Recorder of Deeds. Data covers 2013 through March 27, 2015. This dataset will be updated Quarterly. For more information see http://cookrecorder.com/ .","Cook County Recorder - Foreclosures - 2013 through March 27, 2015","[u'recorder', u'foreclosures', u'mortgages', u'quit claim deeds', u'property']",Filtered View,2423.0,0.04400334156617754
Property & Taxation,Assessment Appeals by Town and Class from Tax Year 2010.,Cook County Assessor - Assessment Appeals by Town and Class - 2010,[],Dataset,2197.0,0.03989902658724393
,The following page lists the unclaimed indigents cremated by the Cook County Medical Examiner’s Office.,Medical Examiner Indigent Cremations,"[u'cremation', u'indigent']",Dataset,1969.0,0.03575839023681534
GIS/Maps,The Parcel 2013 feature contains tax parcel polygons for the 2013 property tax assessment at the County. This feature reflects tax parcel polygons as they existed from 1/1/2013 through 12/31/2013. Each parcel is uniquely identified with a Property Index Number (PIN).,ccgisdata - Parcel 2013,"[u'cook county', u'gis', u'parcel', u'clerk', u'map']",Map,1967.0,0.03572206886532035
GIS/Maps,"This Address Point feature class contains one or more point for each parcel in Chicago that has, within its boundary, an observable, physically addressable structure.",ccgisdata - Address Point Chicago 2014,"[u'address', u'pin', u'cook county', u'gis', u'chicago']",Map,1887.0,0.03426921400552085
Finance & Administration,New check register data can be found at https://datacatalog.cookcountyil.gov/id/gywr-fjeh. This register contains checks from December 2006 through November 2013. This dataset will not be updated.,Cook County Check Register - Fiscal Years 2006 through 2013,"[u'comptroller', u'check register', u'finance']",Dataset,1863.0,0.033833357547580996
Finance & Administration,"Data last updated September 8th, 2011",Department of Revenue - Unincorporated Cook County Municipalities by Township and ZIP,"[u'department of revenue', u'unincoporated cook county municipalities', u'township', u'zip code']",Dataset,1776.0,0.032253377887549034
Property & Taxation,"Foreclosures, Mortgages, and Quit Claim Deeds recorded with the Cook County Recorder of Deeds. Data covers 2013 through March 27, 2015. This dataset will be updated Quarterly. For more information see http://cookrecorder.com/ .","Cook County Recorder - Foreclosures, Mortgages, and Quit Claim Deeds - 2013 through March 27, 2015","[u'property', u'recorder', u'deeds', u'mortgages', u'forclosures']",Dataset,1692.0,0.030727880284759552
Property & Taxation,"Annual Tax Sale: A yearly auction of delinquent taxes where a tax buyer (purchaser) pays the delinquent taxes due on a parcel. This results in a lien on the property. The property owner must repay the tax buyer with interest for the amount of the sale – this is known as “redemption.” If redemption does not occur within a set time period, the tax buyer can obtain legal title to the property – this is referred to as a “tax deed.”",Treasurer - 2009 Annual Tax Sale Sold PINS,"[u'cook county treasurer', u'scavenger sale', u'2009 tax sale', u'sold pin']",Dataset,1640.0,0.029783524625889873
Property & Taxation,"Quit Claim Deeds recorded with the Cook County Recorder of Deeds. Data covers 2013 through March 27, 2015. This dataset will be updated Quarterly. For more information see http://cookrecorder.com/ .","Cook County Recorder - Quit Claim Deeds - 2013 through March 27, 2015","[u'recorder', u'foreclosures', u'mortgages', u'quit claim deeds', u'property']",Filtered View,1631.0,0.029620078454162427
Finance & Administration,Updated 3/19/12.  A list of recent FOIA requests sent to the Office of the President.  This log will be periodically updated.,Freedom Of Information Act (FOIA) Log - Office of the President,[],Dataset,1526.0,0.027713206450675577
GIS/Maps,"This Address Point feature class contains one or more point for each parcel in Suburban Cook County that has, within its boundary, an observable, physically addressable structure.",ccgisdata - Address Point Suburban Cook County 2014,"[u'address', u'pin', u'cook county', u'gis', u'suburb']",Map,1374.0,0.024952782217056515
,"The update script for this dataset is currently broken. Please see the Cook County Clerk SEI Search for recent filings. For extended information about Statements of Economic Interests in Cook County IL, visit the Cook County Clerk's SEI search: http://ethics.cookcountyclerk.com/PublicSearch/",Cook County Clerk -- Statement of Economic Interests Filers,[],Dataset,1318.0,0.023935783815196864
Healthcare,"Data for 2011 through June 2011. Enclosed data represents outpatient registrations including hospital ancillary services (e.g. laboratory, radiology, physical therapy, dialysis), primary and speciality care clinics (Fantus, Stroger Speciality Clinic, Ambulatory Screening Center, Prieto, Austin, Logan Square, Cicero, Vista, Child Advocacy Center, Woodlawn Adult Clinic, Englewood, Morton East, Near South, Sengstacke, Southside Pediatrics, Southside OB, Cottage Grove, Lincoln Robbins, Woody Winston, and OFH Speciality Clinic) same day surgery, CORE center and emergency department registrations","Health & Hospitals System - Outpatient Registrations, by ZIP - Fiscal Year 2011 Incomplete",[],Dataset,1291.0,0.02344544530001453
Property & Taxation,This file contains data on the 2010 Annual Tax Sale Forfeited PIN's.,Treasurer - 2010 Annual Tax Sale Forfeited PINS,[],Dataset,1273.0,0.02311855295655964
GIS/Maps,This Municipality feature class interprets the location and describes the boundaries of all municipalities and unincorporated areas within the borders of Cook County. Attribution for this feature class includes a municipality name and agency description.,ccgisdata - Municipality 2014,[u'municipal boundaries'],Map,1226.0,0.02226500072642743
Finance & Administration,Data last updated December 2011,IEPA State Compost Facilities,[],Dataset,1200.0,0.02179282289699259
GIS/Maps,Cook County GIS Dept index of the Cook County GIS township maps.,ccgismap - Index to Township Maps,"[u'gis', u'index', u'township']",File or Document,1179.0,0.02141144849629522
GIS/Maps,"Cook County GIS Department map of Cook County Commissioner Districts in PDF format.  Includes major streets, waterbodies, rail, and Cook County Commissioner District boundaries.",ccgismap - Cook Commissioner Districts,"[u'cook county', u'commissioner district', u'map']",File or Document,1163.0,0.021120877524335318
Finance & Administration,Executive Recommendation for the Fiscal Year 2015 Budget Department Line Item Budget. For more information on the budget and schedule of public hearings see http://www.cookcountyil.gov/budget/,Budget - Fiscal Year 2015 Budget Executive Recommendation - Summary By Object Classification,"[u'budget', u'executive recommendation', u'fiscal year 2015']",Dataset,1089.0,0.019776986779020775
Property & Taxation,This file contains data on the 2009 Annual Tax Sale Forfeited PIN's.,Treasurer - 2009 Annual Tax Sale Forfeited PINS,"[u'cook county treasurer', u'scavenger sale', u'2009 tax sale', u'forfeited pin']",Dataset,1070.0,0.019431933749818393
Finance & Administration,"This dataset is updated nightly. For extended information about Lobbyist Activities in Cook County IL, visit the Cook County Clerk's Lobbyist search: http://lobbyist.cookcountyclerk.com/Public/SearchHome.aspx",Cook County Clerk - Lobbyist Activity,[],Dataset,1033.0,0.01875998837716112
Property & Taxation,"Properties sold at the 2011 Treasurer's Scavenger Sale, by PIN",Treasurer - 2011 Scavenger Sale Sold PINs,[],Dataset,1030.0,0.01870550631991864
"Forest Preserves, Parks & Recreation","KML file of trails within the Forest Preserve District of Cook County. To view or use these files, special GIS software such as Google Earth is required",Forest Preserve--Cook County Forest Preserve Trails,"[u'maps', u'forest preserve', u'trails', u'paths']",File or Document,1004.0,0.0182333284904838
GIS/Maps,"This is a Cook County Feature class of Unincorporated Zoning District Boundaries by parcel.  This data is provided by the Cook County Dept. Of Building and Zoning and is maintained by the Cook County Zoning Board of Appeals.
Only unincorporated district boundaries are available, please contact specific municipalities for questions regarding incorporated municipal zoning districts.",ccgisdata - Unincorporated Zoning by Parcel 2014,"[u'zone', u'zoning', u'unincorporated', u'building and zoning', u'zoning board of appeals']",Map,996.0,0.01808804300450385
Finance & Administration,Fiscal Year 2014 Adopted and Adjusted Appropriations with Final Fiscal Year 2014 Expenditures and Fiscal Year 2015 Adopted Appropriation,Budget - FY2014 Appropriations And Expenditures with FY2015 Adopted Appropriation,"[u'budget', u'expenditures']",Dataset,957.0,0.01737977626035159
Property & Taxation,"Foreclosures recorded from January 1, 2011 through December 31, 2011",Cook County Recorder of Deeds - Foreclosures - 2011 Complete!,[],Dataset,949.0,0.01723449077437164
Property & Taxation,Homeowner Exceptions by Town Number/Township in Tax Year 2010.,"Cook County Assessor - Homeowner Exemptions, by Town Number/Township - 2010",[],Dataset,924.0,0.016780473630684294
,"Quarterly STAR Data
Sec. 2-932. - Quarterly Submissions to
President and Board
Each County Department and Agency shall prepare a Quarterly Record wherein it shall define its mission and establish measurable goals specific and measurable performance indicators, with corresponding performance objectives and targets",STAR Quarterly Performance Data,"[u'star', u'star data', u'quarterly data']",Dataset,922.0,0.016744152259189307
Property & Taxation,"Annual Tax Sale: A yearly auction of delinquent taxes where a tax buyer (purchaser) pays the delinquent taxes due on a parcel. This results in a lien on the property. The property owner must repay the tax buyer with interest for the amount of the sale – this is known as “redemption.” If redemption does not occur within a set time period, the tax buyer can obtain legal title to the property – this is referred to as a “tax deed.”",Treasurer - 2010 Annual Tax Sale Sold PINS,[],Dataset,912.0,0.016562545401714368
GIS/Maps,The Parcel 2014 feature contains tax parcel polygons for the 2014 property tax assessment at the County. This feature reflects tax parcel polygons as they existed from 1/1/2014 through 12/31/2014. Each parcel is uniquely identified with a Property Index Number (PIN).,ccgisdata - Parcel 2014,"[u'cook county', u'gis', u'parcel', u'clerk', u'map']",Map,910.0,0.01652622403021938
Property & Taxation,This file contains the 2009 Scavenger Sale No Bid PIN's.,Treasurer - 2009 Scavenger Sale No-bid PINS,"[u'cook county treasurer', u'2009 scavenger sale', u'tax sale', u'no bid pin']",Dataset,888.0,0.016126688943774517
Property & Taxation,"Mortgages recorded with the Cook County Recorder of Deeds. Data covers 2013 through March 27, 2015. This dataset will be updated Quarterly. For more information see http://cookrecorder.com/ .","Cook County Recorder - Mortgages - 2013 through March 27, 2015","[u'recorder', u'foreclosures', u'mortgages', u'quit claim deeds', u'property']",Filtered View,876.0,0.01590876071480459
Economic Development,"Every year your Cook County government budgets and spends more than $3 billion. Your County's budget impacts your life every day. All of its funding comes from you - your sales and property taxes, your purchase fees on gas and other goods. All of its spending exists to support you, too. County funding drives the forest preserve district, the jail, public hospitals and clinics, the Cook County courts and dozens of other civic institutions designed to make our region prosperous, efficient and fair.
Yet too many residents don't understand what Cook County government is or what it does. They keep asking, ""where exactly does our money go?""
Commissioner John Fritchey created this budget transparency tool to answer that question, but it's only a first step. We need your help. What questions do you have about County spending? What do you want to know about the County budget that this visualization isn't explaining to you? What do you think of our spending? What can we do to make Cook County government better?",Cook County Budget 1993-2011,[],Dataset,866.0,0.015727153857329652
Property & Taxation,"Quit Claim Deeds recorded from January 1, 2011 through December 31, 2011",Cook County Recorder of Deeds - Quit Claim Deeds - 2011 Complete!,[],Dataset,860.0,0.01561818974284469
GIS/Maps,The feature class Right-of-Way indicates tax exempt rights-of-way digitized from recorded plats.,ccgisdata - Right-of-Way 2012,"[u'cadastral', u'tax map', u'property', u'lot', u'cook']",Map,835.0,0.015164172599157344
GIS/Maps,"The Public Land Survey System (PLSS) forms the foundation of Cook County's cadastral system for identifying and locating land records. Tax parcels are identified using township and section notation, in a modified format. This PLSS feature data set is intended to correspond to tax pages in the Cook County Assessor's Tax Map book (current as of tax year 2000 for 66% of the County and as of tax year 2001 for the remaining 33% of the County), and should not be used for measurement or surveyor purposes. In addition, the parcel attributes PINA (area/township) and PINSA (subarea/section) do not necessarily correspond to the PLSS township and section polygon in which a given parcel resides. The PLSS data is modeled as a single composite network coverage that encompasses townships (area), sections (subarea), quarter sections, and half quarter section.",ccgisdata - Survey Township (Area) 2014,"[u'gis', u'area', u'township', u'plss']",Map,834.0,0.01514601191340985
GIS/Maps,"The railroad feature data layer depicts the location of railroad tracks (including single and multiple line tracks, railyards, and spurs) and railroad stations in Cook County, Illinois.",ccgisdata - Railroad 2014,"[u'cook county', u'railroad', u'train', u'tracks']",Map,817.0,0.014837280255702455
GIS/Maps,Paved road edge polygons show the location of pavement edges along a road,ccgisdata - Road Edge 2014,"[u'gis', u'road', u'planimetry', u'street', u'pavement']",Map,798.0,0.014492227226500072
Property & Taxation,2009 Scavenger Sale Registered Buyers. They are registered to purchase taxes on property that have not been paid for 2 years,Treasurer - 2009 Scavenger Sale Registered Buyers,[],Dataset,788.0,0.014310620369025135
Economic Development,County facilities by location and type of services provided at that location.,Facilities Management - Find it Fast - Cook County Facilities and Services Locator,[],Dataset,774.0,0.014056370768560221
GIS/Maps,"This is a Cook County Feature class  of Unincorporated Zoning District Boundaries (Aggregate).  This data is provided by the Cook County Dept. Of Building and Zoning and is maintained by the Cook County Zoning Board of Appeals.
Only unincorporated district boundaries are available, please contact specific municipalities for questions regarding incorporated municipal zoning districts.",ccgisdata - Unincorporated Zoning Districts 2014,"[u'zone', u'zoning', u'unincorporated', u'building and zoning', u'zoning board of appeals']",Map,774.0,0.014056370768560221
Property & Taxation,PIN information for 2010,Board of Review - 2010 PIN information,"[u'board of review', u'2010 pin information', u'property']",Dataset,754.0,0.013693157053610345
GIS/Maps,The Street Midlines in this feature class represent the interpreted midline between the compiled edges of pavement. Unimproved rights-of-way are also included in this database.,ccgisdata - Street Midlines 2014,"[u'streets', u'midlines', u'centerlines', u'gis', u'maps']",Map,752.0,0.013656835682115356
Finance & Administration,Executive Recommendation for the Fiscal Year 2016 Budget Summary of Positions by Business Unit. For more information on the budget and schedule of public hearings see http://www.cookcountyil.gov/budget/,Budget - Fiscal Year 2016 Executive Recommendation - Budget Summary Of Positions By Business Unit,[u'2016 budget executive recommendation'],Data Lens,741.0,0.013457068138892924
Finance & Administration,An exempt position is one that involves policy making to an extent or is confidential in such a way that political affiliation is an appropriate consideration for the effective performance of the job. Please refer to the exempt list and associated job descriptions for more information.,Human Resources - Exempt Positions,[],Dataset,738.0,0.013402586081650443
Property & Taxation,Tax code rates for Tax Years 2006 through 2013. Data is updated yearly. For more information on Tax codes visit the Cook County Clerk's website at: http://www.cookcountyclerk.com/tsd/Pages/default.aspx,Cook County Clerk - Tax code Rates,[],Dataset,735.0,0.013348104024407961
GIS/Maps,"Forest Preserve District of Cook County boundaries. To view or use these shapefiles, compression software and special GIS software, such as ESRI ArcGIS, is required.",GIS--Shapefiles of Cook County Forest Preserve Boundaries,"[u'gis', u'maps', u'forest preserve boundaries']",File or Document,719.0,0.013057533052448061
Property & Taxation,This is a File that contains Scavenger Sale Sold PIN's,Treasurer - 2009 Scavenger Sale Sold PINS,[],Dataset,695.0,0.012621676594508208
Property & Taxation,2011 Scavenger Sale Registered Buyers. They are registered to purchase taxes on property that have not been paid for 2 years,Treasurer - 2011 Scavenger Sale Registered Buyers,[],Dataset,687.0,0.012476391108528257
,,STAR Data - Monthly,[],Dataset,682.0,0.01238558767979079
Finance & Administration,"Data from September 19, 2011. A daily report on the budgets of Cook County Government agencies and departments.",Budget Management - Daily Appropriations Report,"[u'budget management', u'daily appropriations report']",Dataset,677.0,0.01229478425105332
Property & Taxation,PIN information for 2009,Board of Review - 2009 PIN information,"[u'board of review', u'2008 pin information', u'property']",Dataset,667.0,0.012113177393578381
,List of Elected Officials via Jurisdiction along with the City they represent,County Clerk --  Directory Of Elected Ofiicials - via Jurisdiction,[],Dataset,663.0,0.012040534650588406
Finance & Administration,Performance management data from Cook County Government departments and agencies for Q2 2011.,Office of the President - S.T.A.R. Report - 2011 Q2,[],Dataset,657.0,0.011931570536103444
"Forest Preserves, Parks & Recreation","KML file of the boundaries of Cook County Forest Preserve facilities. To view or use these files, special GIS software such as Google Earth is required",Forest Preserve District--Boundaries of Cook County Forest Preserves,"[u'forest preserve', u'cook county forest preserve boundaries', u'county park boundaries']",File or Document,643.0,0.01167732093563853
Economic Development,"Use the tools at right to find the Cook County Government location or service you need.  Click on the icon to see the location name, type, type of service offered, and contact information.",Cook County Health and Hospitals Facilities,"[u'cook county facilities and services locator', u'capital planning and policy']",Map,636.0,0.011550196135406072
GIS/Maps,Cook County GIS Dept map of Commissioner District 17,ccgismap - Cook County Commissioner District 17,"[u'commissioner district', u'cook county', u'map', u'gis']",File or Document,636.0,0.011550196135406072
Economic Development,Last Updated September 2011,Building and Zoning - Certificate Of Occupancy Issued - Fiscal Year 2009 through part of Fiscal Year 2011,[],Dataset,631.0,0.011459392706668604
Finance & Administration,Address and fee information for Asbestos Removal Permits in 2010,Environmental Control - Asbestos Removal Permits - 2010,"[u'environmental control', u'asbestos removal', u'permits', u'demolition', u'buildings hazardous materials']",Dataset,626.0,0.011368589277931135
Finance & Administration,Data covers December 2010 through June 2011.,"Board of Ethics - Summary of Activity, by Month - Fiscal Year 2011 Incomplete",[],Dataset,597.0,0.010841929391253814
